Summary,Rating,cluster
The witching hour strikes Brimming intricate battles take place epic set pieces Bayonetta 2 finds sassy heroine battling angels demons unearthly beautiful HD Youre bound love feels string together combos unimaginable weapons summon demons using Bayonettas Umbran Weave frantic stylized action game,4.1,8
Celebrate 2 years Sonic new adventure delivers definitive experience Sonic fans new old The Japanese version different subtitles White Time Space home consoles Blue Adventures 3DS version All versions game played 3D 3DTV well pair 3D glasses required PlayStation 3 Xbox 36 versions first game franchise played 3D It uses stereoscopic 3D involvement pair screens one,3.8,5
In Shin Megami Tensei III Nocturne player takes role young boy caught apocalypse visiting sick teacher Yuko Takao two classmates Chiaki Hayasaka Isamu Nitta The player must survive Vortex World new powers capabilities given protagonist Magatama obtained Lucifer With powers player given opportunity align Reason decides world become,4.2,2
Reaping souls dead punching clock might get monotonous honest work Crow The job gets lively assigned soul stolen must track desperate thief realm untouched death creatures grow far past expiry overflow greed power,3.8,4
Devil May Cry 3 Dantes Awakening Special Edition rerelease Devil May Cry 3 gameplay changes additional content Among possibility play Vergil separate save file,4.4,5
Assassins Creed IV Black Flag begins 1715 pirates established lawless republic Caribbean ruled land seas These outlaws paralyzed navies halted international trade plundered vast fortunes They threatened power structures ruled Europe inspired imaginations millions left legacy still endures,3.7,1
The Legend Zelda Twilight Princess last Zelda game GameCube highly anticipated many members gaming community regarded finally fulfilling dreams wanted much realistic mature game ones The art similar naturalistic style Ocarina Time rather celshaded look The Wind Waker The main adventure takes place several provinces dungeons temples New game ability Link transform Wolf entering Twilight As wolf Link use senses solve puzzles get past obstacles also dig holes find hearts rupees Twilight Princess received universal acclaim reviewers journalists cited greatest Zelda game time,4.0,6
Crisis Core Final Fantasy VII Reunion HD remaster smash hit prequel Final Fantasy VII In addition graphics remastered HD fully voiced dialogue new soundtrack arrangements make dynamic new retelling beloved classic,3.8,8
A 3D explorationfocused metroidvania firstperson shooting mechanics first 3D entry Metroid series Metroid Prime follows Samus Aran events Metroid 1986 boards Space Pirate frigate chases escaping archrival Ridley intricately structured Tallon IV planet full deadly wildlife former home advanced ancient Chozo race,4.3,4
Dr Eggman aka Dr Robotnik returned turning helpless animals robots forcing build ultimate weapon Death Egg But time Sonic friend help Tails Find 7 Chaos Emeralds stop Dr Robotniks evil scheme,3.7,4
Metal Gear Solid 4 Guns Patriots final canonical Metal Gear game feature Solid Snake main character The gameplay previous games kept along new features ability roll back also hide bins scattered around environment Most story relationship characters explained cutscenes considerable length knowledge prior games recommended fully understand story The game also features complex multiplayer mode entitled Metal Gear Online original missions based stealth aspects singleplayer games,3.9,9
Atomic Heart adventure firstperson shooter events unfolds alternate universe high noon Soviet Union The principal character game special agent P3 unsuccessful landing enterprise 3826 trying figure went wrong,3.0,1
Minecraft focuses allowing player explore interact modify dynamicallygenerated map made onecubicmetersized blocks In addition blocks environment features plants mobs items Some activities game include mining ore fighting hostile mobs crafting new blocks tools gathering various resources found game The games openended model allows players create structures creations artwork various multiplayer servers singleplayer maps Other features include redstone circuits logic computations remote actions minecarts tracks mysterious underworld called Nether A designated completely optional goal game travel dimension called End defeat ender dragon,4.2,2
Resident Evil 5 seventh video game Resident Evil series It features similar gameplay Resident Evil 4 utilizing shoulder view time environment plays significant role The player dependent partner older games When partners health bar drop enter dying stage health bar flash red gradually lower stays like Resident Evil 5 also features new types enemies called Majini mostly African descent,3.1,5
In game Neku Sakuraba allies forced participate game determine fate The battle system uses many unique features Nintendo DS including combat takes place screens attacks performed certain motions touchscreen shouting microphone Elements Japanese youth culture fashion food cell phones key aspects missions,4.2,1
A Hat Time cuteasheck 3D platformer featuring little girl stitches hats wicked powers Freely explore giant worlds recover Time Pieces travel new heights,4.0,4
Scorn atmospheric first person horror adventure game set nightmarish universe odd forms somber tapestry It designed around idea thrown world Isolated lost inside dreamlike world explore different interconnected regions nonlinear fashion The unsettling environment character Every location contains theme story puzzles characters integral creating cohesive lived world Throughout game open new areas acquire different skill sets weapons various items try comprehend sights presented,3.0,2
Armies clash world burns As inevitable war draws ever closer must stand Chrom forcesknights mages archers morecommanding armies kingdoms empires dead Plan strategery Move troops battlefield choose weapon attack Using new Pair Up Dual systems support attacks help nearby allies watch skills relationships grow,3.8,0
In Cuphead The Delicious Last Course Cuphead Mugman joined Ms Chalice DLC addon adventure brand new island With new weapons new charms Ms Chalices brand new abilities take new cast multifaceted screenfilling bosses assist Chef Saltbaker Cupheads final challenging quest,4.3,0
The little spirit Ori stranger peril fateful flight puts owlet Ku harms way take bravery bring family back together heal broken land discover Oris true destiny From creators acclaimed actionplatformer Ori Blind Forest comes highly anticipated sequel Embark allnew adventure vast world filled new friends foes come life stunning handpainted artwork Set fully orchestrated original score Ori Will Wisps continues Moon Studios tradition tightly crafted platforming action deeply emotional storytelling,4.3,4
What starts routine mission agrarian outpost quickly becomes opening salvo epic war As newly appointed Executive Officer SSV Normandy youll assemble lead elite squad heroes battle heartpounding battle Each decision make impact fate destiny entire galaxy Mass Effect trilogy Key Features Incredible interactive storytelling Create customize character Commander Shepards appearance skills personalized arsenal Unleash devastating abilities command train Your decisions control outcome mission relationships crew ultimately entire war An amazing universe explore From massive Citadel harsh radioactive landscape Krogan home world incredible breadth Mass Effect universe blow away Travel farthest outposts aboard SSV Normandy technologically advanced ship galaxy Youll follow clues left ancient civilizations discover hidden bases fantastic new tech lead handpicked crew explosive alien battles Edgeofyourseat excitement meets strategic combat Find perfect combination squadmates weapons battle want lead victory SunTzus advice remains pertinent 2183 today know enemy Youll need different tactics squad enemies devastating biotic attacks heavily armored Geth Colossus choose teams wisely,3.8,0
In 1bit firstperson mystery game merchant ship called Obra Dinn appeared London harbor years declared lost sea As insurance adjuster player must examine ship clues,4.3,1
Kingdom Hearts III third main installment Kingdom Hearts series developed published Square Enix It initially released January 219 PlayStation 4 Xbox One An expansion Kingdom Hearts III Re Mind released January 22 The story takes place events Kingdom Hearts 3D Dream Drop Distance It features older Sora main protagonist sets forth new adventure search seven guardians light attempt stop Xehanort bringing second Keyblade War Sora joined Donald Duck Goofy Mickey Mouse Riku Kairi others Along way Sora travels many worlds Disney Pixar intellectual properties cross paths real Organization XIII Kingdom Hearts III features hack slash combat reminiscent Kingdom Hearts II elements later handheld entries allowing player control Sora party Donald Goofy two Disney characters various worlds visits A major addition compared Formchange mechanic allows currently equipped Keyblade grant special abilities change shape Sora equip three Keyblades time cycle use abilities Another addition Attractions mechanic occasionally allows Sora summon pilot vehicle inspired Disney theme park attractions At certain points throughout game player able control characters,3.5,2
Fallout 3 creators awardwinning Oblivion featuring one realized game worlds ever created Create kind character want explore open wastes postapocalyptic Washington DC Every minute fight survival encounter Super Mutants Ghouls Raiders dangers Wasteland Prepare future The third game Fallout series Fallout 3 singleplayer action roleplaying game RPG set postapocalyptic Washington DC Combining horrific insanity Cold War era theory mutually assured destruction gone terribly wrong kitschy naivety American 195s nuclear propaganda Fallout 3 satisfy players familiar popular first two games series well coming franchise first time,3.4,1
A 4yearold clue coffin Sir Francis Drake sets modernday fortune hunter exploration fabled treasure El Dorado leading discovery forgotten island middle Pacific Ocean The search turns deadly Nathan Drake becomes stranded island hunted mercenaries Outnumbered outgunned Drake companions must fight survive begin unravel terrible secrets hidden Island,3.1,1
The first game Zero Escape series originally made standalone title Nine Hours Nine Persons Nine Doors The Zero Escape rebranding alternative cover game released around time Sequel Zero Escape Virtues Last Reward The game murder mystery visual novel heavy story focus requires multiple playthroughs figure involves puzzle rooms used progress story dialogue choices made inbetween The iOS version game removed puzzle rooms focus visual novel aspects game The puzzle rooms replaced narration events take place instead The iOS version game also exclusive ending,4.2,2
Lost Judgment puts players sneakers lawyer turned streetfighting detective Takayuki Yagami Joined partner exyakuza Masaharu Kaito crimefighting duo called investigate seemingly perfect crime whose lead suspect airtight alibi What starts tale revenge reveals tangled web conspiracy involving several unlikely factions taking advantage broken law system But victims pile Yagami unravels truth must choose defending law exacting justice,4.3,2
Super Mario 3D Land second 3D Super Mario platformer handheld device successor Super Mario Galaxy 2 The game closely based sidescrolling Mario games combine elements traditional 2D Mario games modern freeroaming 3D Mario games It also introduces elements series including powerups gameplay mechanics,3.5,3
Gris hopeful young girl lost world dealing painful experience life Her journey sorrow manifested dress grants new abilities better navigate faded reality As story unfolds Gris grow emotionally see world different way revealing new paths explore using new abilities Gris serene evocative experience free danger frustration death Players explore meticulously designed world brought life delicate art detailed animation elegant original score Through game light puzzles platforming sequences optional skillbased challenges reveal Griss world becomes accessible,3.6,8
Silent Hill 3 third installment Silent Hill survival horror series direct sequel first game although kept secret player plot twist purposes Like previous entries Silent Hill 3 survival horror combining actionbased combat puzzlesolving somewhat combatoriented preceding installments The main character able sidestep block attacks general shares protagonists series relative ineptitude combat,4.2,2
Call Duty Modern Warfare 2 firstperson shooter video game developed Infinity Ward published Activision Xbox 36 PlayStation 3 video game consoles Microsoft Windows operating system Officially announced February 11 29 game released worldwide November 1 29 It sixth installment Call Duty series direct sequel Call Duty 4 Modern Warfare continuing storyline Call Duty Modern Warfare 3 set end storyline,3.8,5
The Walking Dead Season One also known The Walking Dead The Game episodic interactive drama graphic adventure video game developed published Telltale Games Based Robert Kirkmans The Walking Dead comic book series game consists five episodes released April November 212 It available Android iOS Kindle Fire HDX Microsoft Windows Mac OS X PlayStation 3 PlayStation Vita Xbox 36 PlayStation 4 Xbox One The game first The Walking Dead video game series published Telltale,4.0,5
Mario Kart DS continuation long running racing game series began Super Nintendo It features 16 new tracks well 16 tracks previous 4 games set split Nitro Retro Grand Prix respectively Eight racers initially available two gokarts choose A number characters additional karts also available unlock New items added arsenal including Blooper squid squirts ink onto screens players Bullet Bill power transforms player giant fasttravelling bullet autopilot,3.8,3
Conquer character Apex Legends freetoplay Hero shooter legendary characters powerful abilities team battle fame fortune fringes Frontier Master evergrowing roster diverse Legends deep tactical squad play bold new innovations go beyond Battle Royale experienceall within rugged world anything goes Welcome next evolution Hero Shooter,3.1,0
Devil May Cry 2 sequel Devil May Cry From start game player controls Dante new partner Lucia various levels battle waves demons This game features Amulet system different parts acquired throughout levels equipped accessing pause menu The different parts amulet equipped change aspects characters Devil Triggers form like elemental moves time stop abilities faster movement flight abilities etc,1.6,5
The Legend Zelda Ocarina Time 3D remake Ocarina Time uptodate graphics streamlined UI different additional game modes Most textures significantly detailed many models faithful games concept promotional art In addition frame rate increased 3 FPS compared originals 2 FPS,4.2,6
Twelve Minutes realtime topdown interactive thriller accessible click drag interface Featuring James McAvoy Daisy Ridley Willem Dafoe The game blends dreamlike tension The Shining claustrophobia Rear Window fragmented structure Memento,2.4,1
A thirdperson action RPG cooperative competitive multiplayer elements player enters kingdom Boletaria ravaged fog spawns murderous demons The player hunt arch demons situated five disparate areas within kingdom partake punishing combat reach Old One vengeful brought fog Boletaria,4.1,2
Persona 3 Portable enhanced remake Persona 3 PlayStation Portable The game features option play female character alters aspects story In addition new playable character two new difficulty levels select alongside original games three The game also features story related changes regardless player character gender The battle system also updated closer Persona 4,4.0,5
The Glade Dreams trouble The nightmares multiplied spread creating new monsters even terrifying,4.0,8
In sequel Drakes Fortune Nathan Drake comes across map showcases location Marco Polos missing ships It takes journey find infamous Cintamani Stone uncover truth behind,3.9,4
Welcome new world Take role hunter slay ferocious monsters living breathing ecosystem use landscape diverse inhabitants get upper hand Hunt alone coop three players use materials collected fallen foes craft new gear take even bigger badder beasts,3.8,8
A short story sort challenges everyday little things Help girl buy milk first disappoint,3.3,4
The Legend Zelda A Link Between Worlds first Zelda game made exclusively Nintendo 3DS It indirect sequel A Link Past version Hyrule new characters gameplay elements Unlike series tradition many areas world accessible beginning game dungeons visited order Puzzles encountered dungeons also open world part revolves around games 3D visual effect The 3DS touchscreen display shows world dungeon map depending,4.1,6
Final Fantasy XIV Endwalker fourth expansion pack Final Fantasy XIV The story marketed finale HydaelynZodiark arc drawing current ongoing story close In addition adding new areas expansion pack increases level cap 9 debuts two new character classes Sage Reaper,4.6,8
The Legend Zelda The Minish Cap topdown action adventure game tells origins evil Vaati Four Swords Like titles series The Minish Cap features fully explorable land Hyrule although viewed eyes human eyes Minish race tiny people alternate form Link transform Unlike multiplayer focus games series The Minish Cap retains original form exploration dungeons seen A Link Past Oracle Seasons Oracle Ages well returning characters game mechanics Malon Spin Attack New features include fusing Kinstones shrinking size Minish,3.9,6
Travel real world virtual world Pokmon Pokmon Go iPhone Android devices With Pokmon Go youll discover Pokmon whole new world Join Trainers across globe discovering Pokmon explore world around,2.7,7
Night In The Woods adventure game heavily focused story characters exploration platforming get around town Maes cat roofs ledges powerlines playground shes one long shot Youll also various activities interacting world different ways getting know townspeople hanging friends exploring Possum Springs inside venturing surrounding areas,4.0,8
Building styles ATLUS Persona Devil Summoner Devil Survivor titles SMTIV first true successor 24s Shin Megami Tensei Nocturne The story SMTIV revolves around Samurai sacred protectors Eastern Kingdom Mikado As newly appointed Samurai players struggle factions nefarious designs world defend home kingdom growing army demons Decisions players make throughout course story lasting repercussions fate world hangs balance,4.1,2
Kingdom Hearts II action roleplaying game primary entry series since 22 Disney Interactive Square collaboration The games setting collection various levels referred ingame worlds player progresses As first game II allows player travel locales various Disney works along original worlds specifically created series,4.3,2
The year 235 Soma Cruz witness first solar eclipse 21st century suddenly blacks awaken inside mysterious castle As Soma must navigate castles labyrinths confronting perilous monsters every turn But beware must escape evil consumes,4.2,1
Experience story events Halo Combat Evolved fight defend planet Reach harrowing Covenant invasion In firstperson shooter customize Spartan armor accessories experience pulsepounding campaign addictive multiplayer mode Reach fall wont go without fight,4.0,1
In year 1986 Tommy Vercetti heavily indebted mafia superiors drug deal gone awry dreams taking Vice City based Miami push different path Featuring wide variety vehicles weapons radio stations playing hit songs era intense atmosphere GTA Vice City openworld sandbox satire 8s Miami,3.8,1
Hike climb soar peaceful mountainside landscapes Hawk Peak Provincial Park make way summit,4.1,1
The American Colonies 1775 A brave young warrior fights save homeland But begins struggle territory turns extraordinary journey transform Master Assassinand forever change destiny nation You Connor warrior son Native American mother British father As colonies draw closer revolution dedicate life freedom clan becoming spark ignites revolution full blaze Your crusade take bloodsoaked battlefields crowded city streets perilous wilderness beyond You witness historyyou make Welcome entirely new chapter Assassins Creed saga,3.0,1
Step shadows deadliest dwelling earth Youve arrived Castlevania youre business To destroy forever Curse Evil Count Unfortunately everybodys home evening Bats ghosts every kind creature imagine Youll find em place dont find first Because youve got get six monstrous floors even meet Master House Your Magic Whip help youll probably find weapons two along way But make tower count Duel Death The Count waited 1 years rematch,3.4,1
A sequel Milk inside bag milk inside bag milk Dive demented bizarre world help girl become little happier,3.7,4
Lisa quirky sidescrolling RPG set postapocalyptic wasteland Beneath charming funny exterior world full disgust moral destruction Players learn kind person FORCED make choices These choices permanently effect game play If want save party member death sacrifice strength character Whether taking beating chopping limbs inhuman way You learn world selfish heartless way survive,4.3,8
Crash Bandicoot first installment Crash Bandicoot series established Naughty Dogs reputation video game industry Its premises chronicle creation titular Crash bandicoot uplifted mad scientist Doctor Neo Cortex The goal Crash Bandicoot traverses several levels sequence order progress The game played thirdperson perspective camera trails behind Crash though levels showcase forwardscrolling sidescrolling perspectives Crash able defeat enemies either jumping using spinning attack launches,3.5,5
The Legend Zelda The Wind Waker HD remaster The Wind Waker alternate recreation originals art style several gameplay adjustments new lighting engine higher resolution textures,4.3,6
The Outer Worlds new singleplayer scifi RPG Obsidian Entertainment Private Division As explore furthest reaches space encounter host factions vying power decide become determine fate everyone Halcyon In corporate equation colony unplanned variable,3.2,1
The Legend Zelda Majoras Mask 3D remake original Nintendo 64 game uptodate graphics streamlined UI different additional game modes Most textures significantly detailed many models faithful games concept promotional art In addition frame rate increased 3 FPS compared originals 2 FPS,4.1,6
In narrativedriven thirdperson survival horror game set 3 years future player take role Jacob Lee victim fate thrown Black Iron Prison maximumsecurity penitentiary located Jupiters moon Callisto When inmates begin transform monstrous creatures prison thrown chaos,2.9,2
The Wolf Among Us five episode series creators 212 Game Year The Walking Dead Based Fables DC ComicsVertigo awardwinning comic book series often violent mature hardboiled thriller characters creatures myth lore legend real exist world As Bigby Wolf The Big Bad Wolf human form discover brutal bloody murder Fable taste things come game series every decision enormous consequences,3.9,1
Three years Necromorph infestation aboard USS Ishimura Isaac Clarke awakens coma confused disoriented space station called The Sprawl Just health begins improve The Sprawl overrun even advanced forms alienzombie hybrids,4.0,1
Super Mario Bros 2 2D platformer sequel Super Mario Bros 1985 features 4 selectable characters Mario Luigi Princess Peach Toad navigate dream world Subcon defeat evil toad king Wart Super Mario Bros 2 features different ways interacting enemies world including object carrying mechanic intricate level designs,3.1,3
Until Dawn interactive drama survival horror video game It originally scheduled released PlayStation 3 feature PlayStation Move support August 214 game reintroduced PlayStation 4 exclusive Until Dawn designed played multiple times players miss quite bit content single playthrough Each last nine hours length game mechanics utilize new ingame system called Butterfly Effect choice action player may cause unforeseen consequences later For example locating weapon earlier chapter may allow player pick line chase scene leads back room Throughout game players make difficult decisions ethical moral dilemmas sacrificing one character save another The Butterfly Effect system blurs line right wrong decisions possible players keep eight characters alive well eight die allowing many different paths scenarios well offering several different endings Until Dawn strict autosave system prevent players reloading previous save file earlier point game regret ingame decision made The way change players choice restart game beginning continue end start new game In developer interview said Until Dawn hundreds endings Different endings different variations depending combination characters alive end game The gameplay focused exploration quicktime events discovering clues well making decisions There ingame system keep track clues secrets players discovered total even multiple playthroughs clues allow player piece together mysteries Blackwood In terms gameplay mechanics theme Until Dawn noted similar Heavy Rain Beyond Two Souls Until Dawn met positive critical response upon release praise directed visuals choice mechanic horror elements music voice acting gameplay design Most criticism game drew concerning story mostly second half camera angles character movements partially linear plot,3.4,2
