Summary,Rating,cluster
A sequel Street Fighter Street Fighter II improved upon many concepts introduced first game including use commandbased special moves sixbutton configuration offering players selection multiple playable characters unique fighting style special moves Street Fighter II credited starting fighting game boom 199s Its success led production several updated versions offering additional features characters previous versions well many home versions Some home versions Street Fighter II games sold millions copies SNES port first Street Fighter II Capcoms bestselling consumer game alltime 28 Street Fighter II follows several conventions rules already established original 1987 predecessor The player engages opponents oneonone close quarter combat series besttwooutofthree matches The objective round deplete opponents vitality timer runs If opponents knock time timer runs fighters equal amount vitality left double KO draw game declared additional rounds played sudden death In first Street Fighter II match could last ten rounds clear winner reduced four rounds Champion Edition onward If clear winner end final round either computercontrolled opponent win default singleplayer match fighters lose 2player match After every third match single player mode player participate bonus game additional points The bonus games includes order carbreaking event barrel breaking bonus game barrels dropped conveyor belt player drumbreaking bonus game drums flammable piled The bonus games removed arcade version Super Street Fighter II Turbo Like original games controls uses configuration eightdirectional joystick six attack buttons The player uses joystick jump crouch move character towards away opponent well guard character opponents attacks There three punch buttons three kick buttons differing strength speed Light Medium Heavy The player perform variety basic moves position including grabbingthrowing attacks featured original Street Fighter Like original player perform special moves inputting combination directional buttonbased commands Street Fighter II differs original due selection multiple playable characters distinct fighting styles special moves Additionally player also cancel animation performing another move allowing combination several basic special moves Both features would expanded upon subsequent installments,3.5,5
Resident Evil Revelations survival horror game restores elements series nature opposed survival action Resident Evil 5 The game features singleplayer mode player must complete series episodes involve solving puzzles defeating enemies multiplayer mode players may fight way altered singleplayer scenarios,3.2,5
The story follows nameless protagonist lives nearfuture Tokyo When portal realm demons opened United States officials order nuclear attack Tokyo Transported two supporting characters thirty years future protagonist finds Earth ruined demon invasion stage escalating conflict Order Messiah Ring Gaea conflicting cults wish bring kingdoms respective patron deities YHVH Lucifer The story influenced moral decisions protagonist makes aligning either Order Ring Gaea setting independent agent The gameplay uses firstperson navigation dungeons turnbased battles demons The player recruit demons allies talking rather fighting two three demons fused create new demons,3.3,1
Tomb Raider 3D action game developed Core Design published Eidos Interactive The game follows exploits Lara Croft British female archaeologist search ancient treasures The objective Tomb Raider guide Lara series tombs locations search treasures artifacts On way must kill dangerous animals creatures collecting objects solving puzzles gain access ultimate prize usually powerful artifact The game critically acclaimed widely influential spawned number sequels franchise related media,3.3,2
FIFA 23 brings The Worlds Game pitch HyperMotion2 Technology delivers even gameplay realism mens womens FIFA World Cup coming season womens club teams crossplay features,2.6,0
Battlefield Bad Company 2 brings awardwinning Battlefield gameplay forefront PC gaming bestinclass vehicular combat unexpected Battlefield moments New vehicles like ATV transport helicopter allow allnew multiplayer tactics Battlefield With Frostbiteenabled Destruction 2 system take entire buildings create fire points blasting holes cover You also compete fourplayer teams two squadonly game modes fighting together unlock exclusive awards achievements Battles set across expansive maps different tactical focus The game also sees return B Company squad mature singleplayer campaign,3.6,0
The Walking Dead A New Frontieris episodic graphic adventure game based Robert Kirkmans The Walking Dead comic book series developed Telltale Games It Telltales third season The Walking Dead series The game employs narrative structure past seasons player choice one episode permanent impact future story elements The player choices recorded save files first two seasons additional episode 4 Days carry third season Clementine players companion first season playercharacter season two returns playercharacter along another playercharacter Javier Javi Garcia The game takes place fictional world comic zombie apocalypse occurred The main characters game original characters however due time skips season two seasons two three timeline caught comics,2.8,2
In Ninja Gaiden Black reprise role Ryu Hayabusa ninja extraordinaire This sequel Ninja Gaiden supplies new story new missions plus two difficulty settings cinematic cut scenes provide background protagonist Ninja Gaiden Black also incorporates additional content Hurricane Packs 1 2 includes unlockable content original arcade version Ninja Gaiden,4.3,5
Sid Meiers Civilization V turnbased strategy game player leads civilization stoneage way future tech one way win achieving one number different victory conditions research exploration diplomacy expansion economic development government military conquest You face civilizations either online people played computer civilization 5 features advanced diplomacy system dealing computer controlled civs computer controlled citystates,3.9,4
Experience quiet terror 1bit love letter Junji Ito HP Lovecraft Navigate hellish roguelite reality turnbased combat unforgiving choices Experiment deck event cards discover new forms cosmic horror every playthrough The inevitable awaits,3.7,8
A reinvention original NES titles revamped graphics intuitive touch control Fire Emblem Shadow Dragon finally introduce longtime fans stories gave birth series nearly 2 years ago Japan introducing Fire Emblem franchise broader audience strategy chess fans Fire Emblem Shadow Dragon also reveals back story Marth original lead character Fire Emblem series introduced made popular North America Super Smash Bros series fighting games,3.2,5
Tomodachi Life communication game 3DS players convert Miis Tomodachis create new ones put wide range scenarios ranging charming utterly ridiculous A key feature game texttospeech tech outputs user generated text computerized speech seven languages EFIGS Japanese Korean,3.7,1
Downwell curious game young man guns boots venturing well search untold treasures Make way darkness filled nasty creatures mysterious secrets collect spectacular red gems scattered rocks Step oddly placed shop buy helpful items level caverns battle well dwelling monsters uncover hidden caves filled riches relics No two trips well ever,3.5,1
Bikini Bottom attack robots Help Spongebob Patrick Sandy save Bikini Bottom evil robots The Duplicatotron 3 creating army robots running amock city beach fields everywhere else With many different worlds explore sights see adventure like none References plenty areas show made explored around The delve world learn origin robots Are YOU brave enough save Bikini Bottom,3.8,4
Experience magic Harry Potters first 4 years Hogwarts School Witchcraft Wizardry exciting new way LEGO Harry Potter Years 14 combines first four Harry Potter books films interactive funfilled videogame Players build adventure Privet Drive Triwizard Tournament new LEGO gameplay elements like magical building spellcasting Select 1 playable characters including Harry Potter Ron Weasley Hermione Granger Experience wonder Hogwarts attend lessons mix potions fly broomsticks complete tasks collect LEGO studs relive adventures like never tongueincheek humor creative customization unique LEGO videogames,3.2,2
The legend Zenithia continues What begins innocent voyage boy traveling alongside father develops eyeopening adventure transcends generations You hero making determine path choose wife befriend wagonload quirky monsters along way,4.2,4
A dark fantasy survival horror RPG players must uncover secrets dungeon Fear Hunger,3.8,8
Enter chaos war bold Knight brutal Viking deadly Samurai Play thrilling story campaign fight brutal PvP modes new dedicated servers Enjoy evolved experience 18 Heroes 18 maps new PvP ranked modes thousands gear items,2.8,0
When Deadly Six threaten destroy world Sonics new moves powerups way defeat late This first three titles Sega Nintendos exclusive collaboration others Mario Sonic Sochi 214 Olympic Winter Games Sonic Boom Rise LyricSonic Boom Shattered Crystal,2.5,4
Bug Fables The Everlasting Sapling adventure RPG following three heroes Vi Kabbu Leif embark epic quest Bugaria search treasure immortality The game combines flat objects 3D physics player jumps utilizes heroes unique abilities solve puzzles stun enemies exploring variety unique colorful areas Battles turnbased timed button inputs enhance abilities,4.1,2
See Hyrule 1 years Legend Zelda Breath Wild game experience events Great Calamity Join struggle brought Hyrule knees Learn Zelda four Champions King Hyrule dramatic cutscenes try save kingdom Calamity The Hyrule Warriors Age Calamity game way see firsthand happened 1 years ago Battle hordes Hyrules formidable foes From barbaric Bokoblins towering Lynels menacing monsters emerged droves In addition Link Zelda take control characters like four Champions young Impa Use distinct abilities carve hundreds enemies save Hyrule impending Calamity,3.5,6
The Caped Crusader joins forces super heroes DC Comics universe blasts outer space stop evil Brainiac destroying Earth,3.1,0
Push limits combat skills master new abilities progress unforgiving nonlinear 2D world Face relentless darkness seeks destroy In Moonscars every death lesson learntand overcome challenge new truths revealed,2.9,8
Step shoes Geralt Rivia professional monster slayer time hired defeat ruthless bandit captain Olgierd von Everec man possesses power immortality This expansion The Witcher 3 Wild Hunt packs 1 hours new adventures introducing new characters powerful monsters unique romance brand new storyline shaped choices,4.4,8
The world ruins Only remnant mankind remains hunted near extinction horrors another world As one survivors left venture portals fantastic realms gather resources firepower needed fight back retake lost Remnant From Ashes thirdperson survivalaction game set postapocalyptic world overrun mythical creatures The game provides players three friends unique customizable gameplay experience filled intense shooting melee combat gear weapon crafting character progression dynamicallygenerated levels offer infinite number ways explore take deadly monsters epic bosses,3.2,1
Halo 5 Guardians delivers epic multiplayer experiences span multiple modes fullfeatured level building tools another chapter Master Chief saga The Master Chief saga continues solo 4player cooperative experience spans three worlds A mysterious unstoppable force threatens galaxy The Spartans Fireteam Osiris Blue Team must embark journey change course history future mankind,2.5,0
Sheathe sword draw deck get ready Hearthstone fast paced strategy card game thats easy learn massively fun Start free game Battlenet play cards sling spells summon creatures command heroes Warcraft duels epic strategy With powerful prebuilt decks hundreds additional cards win craft purchase collection never stops evolving Challenge players skill levels Battlenet hone skills practice matches greatest strategists Azeroth Thrall Uther Guldan,2.9,0
Based comic book name Ultimate SpiderMan lets play either hero SpiderMan archnemesis Venom Use unique combat techniques either SpiderMan Venom battle host SpiderMan characters Artistic contributions creators series make authentic SpiderMan experience,3.6,0
Pursue malevolent Chop Goblins time foil devastating weapons bitesized FPS creator Dusk Iron Lung Squirrel Stapler,3.5,4
Initially released Japan 1993 Secret Mana took world storm innovative realtime battle system gorgeously rendered world It continues stand among action RPGs seamless gameplay anyone beginner veteran enjoy One memorable elements Mana series Ring Command menu system With single press button ringshaped menu appears screen players use items change weapons variety actions without needing switch screens This Ring Command menu system Mana series well known first introduced Secret Mana since appeared games series Play Randi two companions Primm Popoi adventure around world At center epic story mystical power Mana Battle empire quest control Mana Befriend eight elementals wield forces nature Numerous encounters await every turn,3.3,1
A kidnapping streets Shibuya brings together hotblooded detective hardhitting journalist former gang leader head researcher big pharma manufacturer parttimer stuck cat costume series events unexpected outrageous last,4.2,1
Potion Craft alchemist simulator physically interact tools ingredients brew potions Youre full control whole shop invent new recipes attract customers experiment hearts content Just remember whole town counting,3.2,1
THE BLUE BOMBER BLASTS INTO A WHOLE NEW DIMENSION Mega Man blasts way third dimension amazing new adventure Mega Man Legends combines best classic Mega Man action enormous bosses riveting storyline depth hottest RPG Explore vast 3D worlds quest find treasure treasures Mother Lode Youll love new 3D graphics deadly weapons nonstop action unless course youre boss Awesome Weapons Diabolical Bosses Legendary Gameplay NonStop 3D Action,3.7,1
Xenoblade Chronicles Future Connected takes place one year main story delves deeper relationship Shulk Melia face mysterious new threat,3.5,0
Crab Game FirstPerson Multiplayer game play several different minigames based childrens games one player stands victorious,2.5,5
Your friend sets date NEET Cousin Kara,2.7,1
Dantes Inferno epic single player thirdperson action adventure game inspired Inferno part one Dante Alighieris classic Italian poem The Divine Comedy Featuring nonstop action rendered 6 framespersecond signature upgradable weapons attack combos manafueled spells choice punishing absolving souls defeated enemies classic Medieval tale eternal conflict sin resulting horrors hell adapted new generation new medium,3.2,1
The story follows Fiona Belli young girl player must guide Belli Castle immediate environments effort escape Along way players must solve puzzles unlock doors evade hide attempt fight castles inhabitants Fiona accompanied Hewie White Shepherd two must work team solve certain puzzles outwit pursuers,3.8,2
1751 North America Amidst chaos violence French Indian War Shay Patrick Cormac fearless young member Assassins order undergoes dark transformation shape future brotherhood forever After arguing dangerous mission gone tragically wrong Shay betrayed Assassins attempt end life Cast aside called brothers Shay sets mission wipe turned ultimately become feared Assassin hunter history Introducing Assassins Creed Rogue darkest chapter Assassins Creed franchise yet As Shay experience slow transformation Assassin Assassin Hunter Follow creed set extraordinary journey New York City wild river valley far away icy cold waters North Atlantic pursuit ultimate goal bring Assassins,3.2,1
Continue story Banbans Kindergarten Delve deeper bizarre establishment place left suspiciously empty Try survive unexpected residents uncovering truth behind place,1.5,1
In games Stadium Mode one player competes 8 different battles divided four tournaments Beat Stadium Mode youre bonus battle ultimate Pokmon warrior Mewtwo well secret mode gives 8 brandnew devilishly tough battles There virtually way beat secret mode without trained elite Pokmon One four players compete computer noholdsbarred battle customizable rules You select rental Pokmon battles makes much predictable since selection techniques isnt determined trainer You also select quick easy versus random battles,3.3,7
Outlast 2 sequel acclaimed survival horror game Outlast Set universe first game different characters different setting Outlast 2 twisted new journey depths human mind dark secrets No conflict ever black white,2.8,5
The sequel Ni Kuni developed Windows PlayStation 4 Players control Evan Pettiwhisker Tildrum young king usurped castle sets reclaim kingdom While players freely navigate Evan throughout games open world characters controlled battles enemies During battles players use magical abilities elemental creatures known Higgledies used cast spells,3.3,2
Metal Gear considered progenitor stealth game genre also first video game designed Hideo Kojima also directed many later Metal Gear sequels A heavily altered port produced FamicomNES without Kojimas involvement A remade version based original MSX2 game released bonus game Metal Gear Solid 3 Subsistence PlayStation 2 result also included Metal Gear Solid HD Collection Metal Gear Solid The Legacy Collection The game revolves around special forces operative codenamed Solid Snake goes solo infiltration mission fortified state Outer Heaven destroy Metal Gear bipedal walking tank capable launching nuclear missiles anywhere world The player must navigate main character military operative codenamed Solid Snake various locations avoiding visual contact direct confrontation patrolling guards If player seen game enters Alert Mode In situation Snake must escape enemys sight order resume infiltration The method escaping varies depending circumstances behind discovery If Snake seen single exclamation mark appears enemys head enemies players present screen attack Snake escape simply moving adjacent screen However two exclamation marks appear enemy player triggers alarm spotted camera infrared sensor using unsuppressed weapon reinforcements offscreen appear well Snake escape eliminating incoming enemies going outdoors entering elevator The player starts game unarmed eventually acquires firearms Beretta 92F M79 grenade launcher well explosives remote control missiles landmines Ammo supplies weapons limited replenished picking ammunition caches additional supplies Weapons used kill enemies also clear obstacles hollow walls electrified floors Snake also use fists punch defeat patrolling enemies Occasionally player defeats guard punches without alerting anyone defeated guard yield single unit rations ammo box picked In addition enemy guards player also confronted mercenaries challenge player combat serving boss characters The enemy base consists three different buildings multiple floors including basement levels within The player uses key cards items unlock doors explore new areas Each door open corresponding key cards Information obtained rescuing hostages held within buildings After rescuing five hostages players rank increase one star maximum rank four stars allowing increased carrying capacity maximum health However hostage killed player demoted previous rank A transceiver available player communicate commanding officer Big Boss one resistance members operating covertly near Outer Heaven Schneider Diane Jennifer Each Snakes allies specializes specific subject The player must keep track allies frequency numbers order contact All radio messages dependent rooms player located,2.9,9
Disneys Aladdin 1993 video game developed Capcom Super Nintendo Entertainment System SNES Based film name Disneys Aladdin 2D sidescrolling video game player characters Aladdin monkey Abu,3.4,5
Fable 2 second game fable series Lionhead Studios open world roleplaying game It simple story line hero needs save Albion evil Lord Lucian collecting together three heroes defeat Interactive cutscenes large part game however main character never speaks dialogue uncontrolled The game features large variety game play freedom allowing player shape world around characters appearance moral standing based decisions throughout game The player also get married opposite sex bring children childhood farther expressions lot interactive NPCs,3.6,2
This DLC adds 1 new levels 4 minutes new music game,4.5,5
You may played Axiom Verge heard referenced benchmark indie metroidvania adventures Axiom Verge 2 part story Axiom Verge 1 completely new game new characters new powers new enemies new world You play original,3.4,0
As Lightning mission save souls may brought new world However thirteen days remaining everyone saved Armed allnew weapons player customization battle abilities race time fully understand destiny It ends,3.1,4
Yakuza 2 plunges violent Japanese underworld In intense brutal clashes rival gangs police Korean mafia opportunities dole brutal punishment As heroic Kazuma Kiryu original Yakuza explore Tokyo Osaka Wander back alleys Japans underworld trying prevent allout gang war 16 complex cinematic chapters written Hase Seishu famous Japanese author also wrote first Yakuza Endless conflicts surprise plot twists immerse dark shadowy world strongest survive,4.0,1
Its 29 machines competing title FZero X Champion Youre racing speeds 1 kmh high atmosphere Your competition comes every corner galaxy wont shed tear thought smashing track With fourplayer simultaneous gameplay Rumble Pak accessory fastest racing game N64 system,3.9,5
Like families Sandersons bicker money cleaning Unlike families though also robotic spiders aliens talking toys worry Enter ChibiRobo tiny robot programmed spread happiness Join quest restore order Sanderson house SAVE THE WORLD,4.1,4
A port Super Mario Sunshine included Super Mario 3D AllStars featuring updated textures highdefinition widescreen visuals Time hit beach Mario travels beautiful Isle Delfino tropical vacation friends instead finds teaming trusty FLUDD uncover shadowy plot master puppeteer behind His newfound friend also allows Mario traverse worlds sorts unique ways thanks wonderful water pump,3.7,3
A scifi colony sim driven intelligent AI storyteller Generates stories simulating psychology ecology gunplay melee combat climate biomes diplomacy interpersonal relationships art medicine trade,4.2,1
Professor Laytons first adventure Nintendo 3DS system takes colorful city Monte dOr must stop mysterious man wreaking havoc powerful Mask Chaos Unravel new details Professor Laytons past alongside Luke assistant Emmy Altava whole new cast characters riveting story Wrack brain hundreds puzzles weaving way throughout story In addition download free daily puzzles year With robust hint system help players experience levels epic tale packed brim allnew puzzles Professor Layton makes triumphant returnonly Nintendo 3DS,3.7,1
Mega Man returns wild action MEGA MAN X5 This time around terrorists attacked asteroid colony turned artificial gravity Now Mega Man friend Zero defeat terrorists turn gravity keep colony crashing Earth The gameplay fans series come expect Mega Man must use blasters bombs make way eight levels running jumping shooting action If decide play Zero use plasma sword cunning get levels In either case characters face tough bosses unique abilities Once boss defeated Mega Man Zero utilize bosss talents Only Mega Man Zero save colony Earth MEGA MAN X5,3.2,1
Nemo ante mortem beatus Nobody called happy death Herodotus Histories The era Necromancers come The protagonists Kibanohara Ethica Nagaoka Souun young Private Special Living Dead Stalkers By practicing special kind martial art called Close Quarter Armed Martial Arts achieved great heights career Out mission one day Souun becomes involved fierce battle meets young girl Remembering nothing name Hougyou Ilia become target mysterious group necromancers The icecold Tokyo gunpowder smoke living dead crime cybernetics Now begins battle living dead stalkers heroine lives stake,4.6,0
Explore world filled magic Disney discover rich stories build perfect neighbourhood alongside Disney Pixar Heroes Villains new lifesim adventure game Welcome Disney Dreamlight Valley,3.5,0
Mega Man 7 action platform video game developed published Capcom Super Nintendo Entertainment System It seventh game original Mega Man series The game released Japan March 24 1995 localized later year North America Europe,3.5,5
Figment surreal isometric adventure game wherein player must journey subconscious mind save fears nightmares,2.8,2
Flower Sun Rain Nintendo DS port PlayStation 2 puzzle adventure game developed Suda 51 It features touchscreen controls new costumes 1 additional Lost Found puzzles,4.2,5
Join forces expert investigator Professor Layton ace attorney Phoenix Wright unbelievable crossover adventure Find new twists bring courtroom solve puzzles debunk witnesses lies Crossexamine multiple witnesses time uncover mysteries magical city Labyrinthia In medieval town people live fear witchcraft wield Professor Layton Phoenix Wright along assistants Luke Maya join forces face perilous journey filled harrowing mysteries cannot solved mere logic Investigate city Labyrinthia gather information townspeople solving puzzles prove clients innocence court In new group crossexaminations youll pit one witness testimony anothers get story straight literally rewrite history alongside greatest puzzlesolving duo Labyrinthia ever known,3.6,2
